{
  "registryVersion": 2,
  "generatedAt": "2026-10-20T05:35:31.024Z",
  "source": {
    "repository": "https://github.com/fusionseek/jarvis-extensions",
    "commit": "04e97ae8044fcffc883c9da92f7b49a2adc2a1ca"
  },
  "extensions": [
    {
      "manifest": {
        "manifestVersion": 2,
        "id": "android-apps",
        "version": "1.0.2",
        "name": "手机应用",
        "symbol": "apps.iphone",
        "description": "经 adb 扫描连着的安卓手机上装的全部应用：包名、安装包与数据大小，再一屏一屏读出应用名与图标；点一下把包名交给 APK 扫描或数据导出接着处理。",
        "author": {
          "name": "fusionseek",
          "github": "fusionseek"
        },
        "main": "dist/extension.js",
        "sdk": "^2.4.0",
        "minimumJarvisVersion": "3.2.2",
        "capabilities": [
          {
            "id": "android.apps.read",
            "reason": "列出手机上装的应用、它们的大小，再读应用名与图标"
          },
          {
            "id": "android.tools.open",
            "reason": "点行尾按钮时把包名交给 APK 扫描或数据导出"
          }
        ],
        "contributes": {
          "toolbox": {
            "subtitle": "扫描手机应用的大小与包名",
            "keywords": [
              "android",
              "adb",
              "apk",
              "app",
              "package",
              "安卓",
              "图标",
              "存储"
            ]
          }
        },
        "inbox": false
      },
      "path": "extensions/android-apps",
      "bundle": {
        "path": "extensions/android-apps/dist/extension.js",
        "sha256": "f9949a31f66fedc23d277f94f9ca487ef63ea2f2863606163e359fe0c42f1cf0",
        "byteCount": 58302
      },
      "updatedAt": "2026-10-20T09:14:34+08:00"
    },
    {
      "manifest": {
        "manifestVersion": 2,
        "id": "github-project",
        "version": "1.3.0",
        "name": "GitHub 项目",
        "symbol": "tablecells",
        "description": "给 Jarvis「项目」接上 GitHub Projects v2：读 Project 的字段、条目、迭代与 Issue 的父子 / 依赖关系，把你在需求、迭代、缺陷页上的修改写回 GitHub。页面与规则由 Jarvis 画，它只负责读写数据。",
        "author": {
          "name": "fusionseek",
          "github": "fusionseek"
        },
        "main": "dist/extension.js",
        "sdk": "^2.3.0",
        "minimumJarvisVersion": "3.2.2",
        "capabilities": [
          {
            "id": "git.hosting.read",
            "reason": "读 Project 的字段、条目，以及 Issue 的父子与依赖关系"
          },
          {
            "id": "git.hosting.write",
            "reason": "把你在「项目」里的修改写回 Project 与 Issue"
          }
        ],
        "git": {
          "mutations": [
            "updateProjectV2ItemFieldValue",
            "clearProjectV2ItemFieldValue",
            "closeIssue",
            "reopenIssue",
            "updateIssueIssueType",
            "addLabelsToLabelable",
            "removeLabelsFromLabelable",
            "updateIssue",
            "addAssigneesToAssignable",
            "removeAssigneesFromAssignable",
            "addSubIssue",
            "removeSubIssue",
            "addBlockedBy",
            "removeBlockedBy",
            "createProjectV2Field",
            "updateProjectV2Field",
            "createIssue",
            "addProjectV2ItemById"
          ]
        },
        "contributes": {
          "services": [
            {
              "point": "project.engine",
              "id": "github",
              "title": "GitHub Project",
              "subtitle": "读写 GitHub Projects v2：字段、条目、迭代、Issue Type 与 Issue 的父子 / 依赖关系",
              "notes": [
                "token 要有 read:project 才能读、project 才能写回；在 设置 · Git · GitHub 里更新",
                "只执行 Jarvis 校验过的修改；不删字段、不删条目、不删选项",
                "Issue Type 只在组织仓库里有；用户仓库里改类型会被 GitHub 拒绝",
                "增量同步按天过滤、往前多读一天；每页 100 条；「刷新本视图」按 id 读回眼前这一页（一次 100 条）",
                "加选项、加迭代都原样保留已有的 id（含已结束的迭代），映射与条目上的值不受影响",
                "新建：在你选的仓库里建一条 Issue，加进这个 Project；字段由 Jarvis 随后写上"
              ]
            }
          ],
          "git": {
            "hosting": [
              "github"
            ],
            "summary": "Git 设置「Project 关联」与 Projects 分组"
          }
        },
        "inbox": false
      },
      "path": "extensions/github-project",
      "bundle": {
        "path": "extensions/github-project/dist/extension.js",
        "sha256": "7f525eb787ceca2eb12733e650deff616d56e36971f74a057794e984e39ccf85",
        "byteCount": 83458
      },
      "updatedAt": "2026-10-20T09:14:34+08:00"
    },
    {
      "manifest": {
        "manifestVersion": 2,
        "id": "http-status",
        "version": "1.0.6",
        "name": "HTTP 状态码",
        "symbol": "number.circle",
        "description": "输入状态码或关键词，给出这个码的读法、语义、常见成因、怎么处理、相关的码与 RFC 出处。/http 404 或 ⌥⌘/（从剪贴板里抓码）的结果贴着指针原地弹出；也能在工作区窗口里开一枚标签。62 个标准码与 12 个常见非标准码都编在扩展里，不联网。",
        "author": {
          "name": "fusionseek",
          "github": "fusionseek"
        },
        "main": "dist/extension.js",
        "sdk": "^2.0.0",
        "minimumJarvisVersion": "3.0.3",
        "capabilities": [
          {
            "id": "clipboard.read",
            "reason": "⌥⌘/ 按下时读一次剪贴板，从里面找状态码"
          },
          {
            "id": "system.openURL",
            "reason": "点「打开原文」时用默认浏览器打开 RFC / MDN"
          },
          {
            "id": "hotkeys.register",
            "reason": "两条命令的全局快捷键"
          }
        ],
        "contributes": {
          "toolbox": {
            "subtitle": "查一个码：含义、成因、怎么处理",
            "keywords": [
              "status",
              "code",
              "rfc",
              "nginx",
              "cloudflare",
              "接口调试"
            ]
          },
          "window": {
            "subtitle": "在窗口里查状态码：含义、成因、怎么处理、出处",
            "keywords": [
              "status",
              "code",
              "rfc",
              "nginx",
              "cloudflare",
              "接口调试"
            ]
          },
          "commands": [
            {
              "id": "lookup",
              "title": "查状态码",
              "description": "打开面板，落在这个扩展的页面上",
              "hotkey": "⌥⌘H",
              "presentation": "toolbox"
            },
            {
              "id": "explain-clipboard",
              "title": "解释剪贴板里的码",
              "description": "读一次剪贴板，抓出状态码，结果贴着指针弹出",
              "hotkey": "⌥⌘/",
              "presentation": "popover"
            },
            {
              "id": "explain",
              "title": "解释状态码",
              "description": "查 / 后面那个码或关键词，结果贴着指针弹出",
              "slash": {
                "keyword": "http",
                "aliases": [
                  "状态码"
                ],
                "argument": "状态码或关键词"
              },
              "presentation": "popover"
            }
          ],
          "settings": {
            "preferences": [
              {
                "key": "copyFormat",
                "type": "select",
                "title": "复制格式",
                "description": "复制钮与弹窗里那颗 chip 写进剪贴板的形状",
                "default": "name",
                "options": [
                  {
                    "value": "code",
                    "title": "404"
                  },
                  {
                    "value": "name",
                    "title": "404 Not Found"
                  },
                  {
                    "value": "line",
                    "title": "整行含协议"
                  }
                ]
              },
              {
                "key": "specSource",
                "type": "select",
                "title": "出处打开哪一边",
                "description": "点「打开原文」时去 rfc-editor.org，还是 MDN 的中文页",
                "default": "rfc",
                "options": [
                  {
                    "value": "rfc",
                    "title": "RFC 原文"
                  },
                  {
                    "value": "mdn",
                    "title": "MDN 中文"
                  }
                ]
              },
              {
                "key": "includeUnofficial",
                "type": "toggle",
                "title": "搜索包含非标准码",
                "description": "nginx、IIS、Cloudflare 自己造的码；命中时界面上会标出来",
                "default": true
              }
            ]
          }
        },
        "inbox": false
      },
      "path": "extensions/http-status",
      "bundle": {
        "path": "extensions/http-status/dist/extension.js",
        "sha256": "2a8002a401f03e60e8d5fa501d8589d249e75623c2fad5f48c510b4371c9febb",
        "byteCount": 118643
      },
      "updatedAt": "2026-10-20T09:14:34+08:00"
    },
    {
      "manifest": {
        "manifestVersion": 2,
        "id": "mac-apps",
        "version": "1.0.1",
        "name": "应用",
        "symbol": "square.grid.3x3",
        "description": "让 Jarvis 的全局搜索认得这台 Mac 上的应用：打字时结果里出现应用，输入 app 空格看按组排开的图标网格，按住图标进编辑态移到废纸篓、右键在访达中显示。工具箱里这一页是它的显示设置：分组、排序、搜索结果里出几条、要不要系统应用。",
        "author": {
          "name": "fusionseek",
          "github": "fusionseek"
        },
        "main": "dist/extension.js",
        "sdk": "^2.5.0",
        "minimumJarvisVersion": "3.2.3",
        "capabilities": [
          {
            "id": "apps.read",
            "reason": "列出这台 Mac 装的应用，按你的设置分组排好交给全局搜索"
          }
        ],
        "contributes": {
          "toolbox": {
            "subtitle": "全局搜索里应用的分组、排序与显示",
            "keywords": [
              "app",
              "apps",
              "application",
              "launchpad",
              "启动台",
              "程序",
              "spotlight",
              "图标"
            ]
          },
          "services": [
            {
              "point": "launcher.apps",
              "id": "apps",
              "title": "应用",
              "subtitle": "全局搜索里的本机应用：按分类、首字母或位置分组排好"
            }
          ]
        },
        "inbox": false
      },
      "path": "extensions/mac-apps",
      "bundle": {
        "path": "extensions/mac-apps/dist/extension.js",
        "sha256": "32edf41a01a3a345d9a1a56ebd71899144872c21a127ac260e194a2fcfed083d",
        "byteCount": 35874
      },
      "updatedAt": "2026-10-20T09:14:34+08:00"
    },
    {
      "manifest": {